{
  "$schema": "https://json-schema.org/draft/2020-12/schema",
  "title": "LeadCreate",
  "description": "Fields accepted when creating a lead via the public lead form.",
  "$id": "https://raw.githubusercontent.com/api-evangelist/tripleseat/refs/heads/main/json-schema/tripleseat-api-lead-create-schema.json",
  "type": "object",
  "properties": {
    "first_name": {
      "type": "string",
      "example": "Mark"
    },
    "last_name": {
      "type": "string",
      "example": "Lawrence"
    },
    "email_address": {
      "type": "string",
      "format": "email",
      "example": "contact@example.com"
    },
    "phone_number": {
      "type": "string",
      "example": "+1-555-867-5309"
    },
    "company": {
      "type": "string",
      "example": "Acme Events Co."
    },
    "event_description": {
      "type": "string",
      "example": "Evening reception with plated dinner."
    },
    "event_date": {
      "type": "string",
      "format": "date",
      "example": "2026-07-15"
    },
    "start_time": {
      "type": "string",
      "example": "18:00"
    },
    "end_time": {
      "type": "string",
      "example": "22:00"
    },
    "guest_count": {
      "type": "integer",
      "example": 75
    },
    "additional_information": {
      "type": "string",
      "example": "Evening reception with plated dinner."
    },
    "location_id": {
      "type": "integer",
      "example": 500123
    }
  },
  "required": [
    "first_name",
    "last_name",
    "email_address"
  ]
}